id,url,reply_to,text,time
563833901955426,https://facebook.com/563833901955426,563751005297049,"Mine slept in his crib from week one. I pull the crib very close to my bed at night, when he opens his eyes just Pat his back or touch his hands that way he knows you are close, he will feel safe knowing you are around. At daytime i put him to sleep in a different environment, either on my bed or his pram.","06/20/2022, 00:00:00"
563775948627888,https://facebook.com/563775948627888,563751005297049,We had similar sleep issues for about a week right before she turned two months. We moved our bassinet literally right beside my side of the bed and I slept on the edge- mere 6 inches from her. I also put the shirt I sleep in the night before draped over the bassinet and that’s seemed to help us. My girl is 12 weeks and even now sometimes I move her asleep to put her in swing to nap and she wakes but between 5-10 minutes she goes right back to sleep. She also never liked being swaddled- we had a sleep sack and I kept her arms out and she was happier that way. Keep trying- it gets better with consistency!,"06/20/2022, 00:00:00"
563869348618548,https://facebook.com/563869348618548,563775948627888,Christa Milefchik what type of sleep sack you used? I’ve tried the love me and the zen sack,"06/20/2022, 00:00:00"
564044828601000,https://facebook.com/564044828601000,563775948627888,Yudy Grisales-Cuevas I bought this when she was too long for the one that has a wrap to “swaddle” them. Her arms just go out of this and it’s loose so she doesn’t really feel swaddled at all,"06/21/2022, 00:00:00"
564321895239960,https://facebook.com/564321895239960,563751005297049,Try putting a shirt or used breast pad near by so he can smell you!,"06/21/2022, 00:00:00"
563771318628351,https://facebook.com/563771318628351,563751005297049,We transitioned to a bassinet right beside the bed I slept with the bassinet sheet around me (I did the same with the crib sheet I wore it under my shirt for a few hours) and the only soother my babe would take were the bibs… it was a coupe of rough nights but after I started once she was down I would just try to pat her bum and console her without her picking her up right away,"06/20/2022, 00:00:00"
564403598565123,https://facebook.com/564403598565123,563751005297049,"My little will be 5 weeks tomorrow, and the only thing that had been interested in the crib is the cat 🥴😒","06/21/2022, 19:34:33"
564417991897017,https://facebook.com/564417991897017,564403598565123,Lindsay Noble my son's 9 months old and my cats still try and claim his crib as there's when he's not in it lol,"06/21/2022, 20:34:49"
564285105243639,https://facebook.com/564285105243639,563751005297049,"I co-slept with both my kids till about 4.5 months and 4 months. Not fun at all, but it was the only way, no matter what I tried. Sorry, I'm no help at all, but just know that you're not the only one. The newborn and infancy phases are rough. Hang in there!","06/21/2022, 00:00:00"
563806495291500,https://facebook.com/563806495291500,563751005297049,Do you have a bassinet? Since I breastfeed my first born and my now 2 month old they sleep in a bassinet right next to my bed till they are completely sleeping through the night. My first born staid in my room till 6 months and then he slept perfectly fine going to his bed cause he was sleeping “alone”. Maybe try a bassinet. I think stomach is best if they have good head control. I’m sure I’ll get feed back on that. But both my boys have slept on there stomach since birth and sleep so well. I wouldn’t be to worried he doesn’t like his crib right now.,"06/20/2022, 00:00:00"
563819605290189,https://facebook.com/563819605290189,563806495291500,Ashley Craig I keep our bassinet in the living room but our crib is right next to the bed (literally a foot away) he hasn’t much cared for his bassinet since 1 week unfortunately,"06/20/2022, 00:00:00"
563824741956342,https://facebook.com/563824741956342,563806495291500,"I didn’t see that you said about stomach sleeping, my mom and grandmother told me if he sleeps that way and can move his head (he definitely can and is able to push his upper body up for short amounts of time) then to let him but I asked his pediatrician and she said to put him on his back every time 😭 he just will not sleep on his back","06/20/2022, 00:00:00"
563826135289536,https://facebook.com/563826135289536,563806495291500,Valerie Kotnik grandparents and parents have lots of knowledge and I went that route instead of pediatricians. If you do some digging they have changed how babies sleep so many times through the years. I say do what makes baby happy. Some like there backs and some like stomach better. Do what gets baby and momma some sleep!,"06/20/2022, 00:00:00"
563875071951309,https://facebook.com/563875071951309,563751005297049,He would sleep better flat on his back without the pillow!!,"06/20/2022, 00:00:00"
564000241938792,https://facebook.com/564000241938792,563875071951309,Tricia Christensen he will not sleep on his back as mentioned in my original post this is not his usual sleep situation it was an attempt to see if it would help him rest and feel as if he was still being held,"06/21/2022, 00:00:00"
564708098534673,https://facebook.com/564708098534673,563751005297049,My boy is almost 6 months and we still co sleep. We both get our 8+ hours sleep and I love the cuddles. I don’t move in my sleep and I’m very aware of where my boy is.,"06/22/2022, 07:34:33"
564204255251724,https://facebook.com/564204255251724,563751005297049,"Just co sleep. I co sleep with my baby since day 1. She is 6 months now and im her comfort, like u are to ur baby. They cantcself sooth. I breast feed too. Everytime i put her down she wakes up. But if i lay with her or hold her she sleeps","06/21/2022, 00:00:00"
564231235249026,https://facebook.com/564231235249026,564204255251724,Jade Ritter I still need to be able to eat and clean and shower 😭 if I could lay with him all the time I would I know he can’t self soothe I’m okay with having him fall asleep in my arms I just want him to adjust to his crib so I can get stuff done during the day,"06/21/2022, 00:00:00"
564312021907614,https://facebook.com/564312021907614,564204255251724,Valerie Kotnik try having him fall asleep then lay him down n rool a blaket up n put over n let him think its you. Thats the only thing that works on my daughter. I have to make her think im laying woth n holding her,"06/21/2022, 00:00:00"
563888245283325,https://facebook.com/563888245283325,563751005297049,I personally had a bassinet b6 my breed till she was 3/4 months old then transitioned to crib but do whatever you feel is right mama,"06/20/2022, 00:00:00"
563830211955795,https://facebook.com/563830211955795,563751005297049,I have a mobile and my babe loves it. He falls asleep in his crib watching it sometimes!,"06/20/2022, 00:00:00"
563830708622412,https://facebook.com/563830708622412,563830211955795,Taylor La Mar I’ll look into this! He definitely stares at the toys on his mamAroo,"06/20/2022, 00:00:00"
563831901955626,https://facebook.com/563831901955626,563830211955795,Valerie Kotnik they have so many! His has twinkle twinkle and he literally just looks up and watches! Good luck momma!,"06/20/2022, 00:00:00"
563862125285937,https://facebook.com/563862125285937,563751005297049,My daughter refused her crib! We co slept safely with our daughter until she was 4 months now she sleeps on a floor bed and sleeps through the night! Maybe swaddle or a sleep sack that’s weighted?!,"06/20/2022, 00:00:00"
563820275290122,https://facebook.com/563820275290122,563751005297049,The first three months my son would only sleep in the bassinet then the more he was in crib he wanted to sleep in it. By 3 1/2 months he was in his crib.,"06/20/2022, 00:00:00"
563862135285936,https://facebook.com/563862135285936,563751005297049,My baby slept on one of those in her bassinet. I put a thick blanket on top so it was more level but until she started moving more that's how she slept ( I don't want anyone a opinion she's my baby),"06/20/2022, 00:00:00"
563864178619065,https://facebook.com/563864178619065,563862135285936,Kenzie Dawn,"06/20/2022, 00:00:00"
563853925286757,https://facebook.com/563853925286757,563751005297049,I would suggest joining the group Safe Sleep and Baby Care -\-\ Evidence Based Support . It is really helpful!,"06/20/2022, 00:00:00"
563816545290495,https://facebook.com/563816545290495,563751005297049,"Swaddle and put them in there during awake times as well, so it’s a familiar place.","06/20/2022, 00:00:00"
563817821957034,https://facebook.com/563817821957034,563816545290495,Ashley Hayes I will try to have him in his crib during his awake times more! Thank you! I do usually hold him while he’s awake or get some tummy time on his play mat but I’ll see if I can just put a few toys in his crib with him instead maybe that will help,"06/20/2022, 00:00:00"
563833105288839,https://facebook.com/563833105288839,563816545290495,"Valerie Kotnik Also, my older two were tummy sleepers, too. if that's what's most comfortable for him, do that and maybe get an Angelcare monitor for peace of mind if it worries you.","06/20/2022, 00:00:00"
564033698602113,https://facebook.com/564033698602113,563751005297049,Try swaddling him. I love the halo swaddles. My LO instantly falls asleep when we put him in it,"06/21/2022, 00:00:00"
564329255239224,https://facebook.com/564329255239224,563751005297049,You can try removing the rail from the crib and attaching the crib to your bed.,"06/21/2022, 00:00:00"
564002455271904,https://facebook.com/564002455271904,563751005297049,I just started my 4 month old in a crib and his doctor said we shouldn’t be starting until 6 months. Bassinet by your bed,"06/21/2022, 00:00:00"
564006311938185,https://facebook.com/564006311938185,564002455271904,Alexia Drewek he won’t sleep in the bassinet my pediatrician said the crib is fine. The crib is directly next to my bed,"06/21/2022, 00:00:00"
564006455271504,https://facebook.com/564006455271504,564002455271904,Alexia Drewek he won’t sleep in the bassinet my pediatrician said the crib is fine. The crib is directly next to my bed,"06/21/2022, 00:00:00"
564006755271474,https://facebook.com/564006755271474,564002455271904,Valerie Kotnik gotcha. Well good luck!,"06/21/2022, 00:00:00"
564007125271437,https://facebook.com/564007125271437,564002455271904,Alexia Drewek just wondering what the doctors reasoning was for not transitioning until that late? I thought the bassinet was only safe until they started rolling?,"06/21/2022, 00:00:00"
564008778604605,https://facebook.com/564008778604605,564002455271904,I think maybe it was more so because his crib is in his room. But not sure. I’m currently camping in his room right now. He doesn’t roll yet but he’s long and so his face doesn’t fit the mesh part of his bassinet anymore. So if he moves close to the edge he wouldn’t be able to breathe,"06/21/2022, 00:00:00"
563783341960482,https://facebook.com/563783341960482,563751005297049,My little one loves to be swaddled,"06/20/2022, 00:00:00"
563788068626676,https://facebook.com/563788068626676,563751005297049,Did you try different swaddles? Or sleep sack? Did you try to put the shirt that you wore during the day so he can smell it?,"06/20/2022, 00:00:00"
563795361959280,https://facebook.com/563795361959280,563788068626676,"Stella Curiel I haven’t yet tried the one that allows his arms to be up or weighted, he doesn’t like feeling constricted","06/20/2022, 00:00:00"
563822931956523,https://facebook.com/563822931956523,563788068626676,Valerie Kotnik my daughter likes the one with her arms up,"06/20/2022, 00:00:00"
563825625289587,https://facebook.com/563825625289587,563751005297049,Off topic but can you please tell me where you got this Boppy? I’m pregnant and my sons nursery theme is woodland and I would love to have it,"06/20/2022, 00:00:00"
563825915289558,https://facebook.com/563825915289558,563825625289587,Andrea Lindig I’d check Amazon! It was a gift from my grandmother I don’t know where she got it 😭,"06/20/2022, 00:00:00"
564179835254166,https://facebook.com/564179835254166,563825625289587,Okay thank you so much!,"06/21/2022, 00:00:00"
564262421912574,https://facebook.com/564262421912574,563751005297049,Came here to say my son is wearing that same onesie on the same boppy 😂,"06/21/2022, 00:00:00"
564267901912026,https://facebook.com/564267901912026,564262421912574,Jodi Miller so cute 😂🥺,"06/21/2022, 00:00:00"
563813308624152,https://facebook.com/563813308624152,563751005297049,Try a nested bean or a zipadee sleep sack.,"06/20/2022, 00:00:00"
563860915286058,https://facebook.com/563860915286058,563751005297049,We didn’t stop co sleeping until our little one was about 4 months old and we still do it from time to time. Is the crib in your bedroom? We had a bassinet in ours for the first 2 months then he was in bed with us. Once I was ready to transition him to his crib we started we naps during the day. Stay consistent. That’s what worked for me!,"06/20/2022, 00:00:00"
564001538605329,https://facebook.com/564001538605329,563860915286058,"Lauren Brown-Hinds his crib is right next to my bed, naps have been even harder than bed time unfortunately I’m working towards it but tonight is going better than the last couple of nights!","06/21/2022, 00:00:00"
564075528597930,https://facebook.com/564075528597930,563860915286058,Valerie Kotnik I think it just takes time and sometimes is easier as they get older. Our 8 month old ended up in bed with us last night. It happens! You got this!,"06/21/2022, 00:00:00"
563833951955421,https://facebook.com/563833951955421,563751005297049,"My baby’s been co sleeping in this since he was 2 weeks old. It’s helped us transition him and the pillow to the crib and he’s been sleeping in the crib for about 2 months now, we transitioned when we were able to let him sleep through the night. He’ll be 5 months next week. And we’re planning on getting the bigger size for him when he outgrows this one, he loves them!","06/20/2022, 00:00:00"
563911238614359,https://facebook.com/563911238614359,563751005297049,"You could implement a routine at this age. Set up the foundation for sleep training later on. I came across a free sleep seminar when my son was around that age and it helped us out huge! They're actually hosting another one soon. If you're interested in registering, send me a message and I'll get you the link ❤️","06/20/2022, 00:00:00"
564128465259303,https://facebook.com/564128465259303,563911238614359,Sarah Jackson I’m interested ! Lol,"06/21/2022, 00:00:00"
564254085246741,https://facebook.com/564254085246741,563911238614359,Lauren Hynson Risco I sent you the link. Check your requests or send me a message if you don't get it. ❤️,"06/21/2022, 00:00:00"
564324098573073,https://facebook.com/564324098573073,563751005297049,What a cutie!0,"06/21/2022, 00:00:00"
564086315263518,https://facebook.com/564086315263518,563751005297049,Erduana Dërmaku,"06/21/2022, 00:00:00"
563875758617907,https://facebook.com/563875758617907,563751005297049,I love it,"06/20/2022, 00:00:00"
563768831961933,https://facebook.com/563768831961933,563751005297049,We had to use swaddles!,"06/20/2022, 00:00:00"
